{
  "pack_id": "claim_semantics_v1",
  "schema_version": 1,
  "evaluator_id": "claim_semantics_v1",
  "description": "Lean deterministic claim-semantics oracle fixtures. Human-adjudicated gold atoms and allowed-match edges only.",
  "fixtures": [
    {
      "id": "F01",
      "title": "Adam first/second moment \u2014 omission trap",
      "draft_text": "Adam maintains an exponentially decaying average of past gradients (the first moment). Adam maintains an exponentially decaying average of past squared gradients (the second moment).",
      "draft_sha256": "5a2abcf0488085a32e3f1ad9296eaa3d54727032843f3a4caf12a20ae0bbbd52",
      "gold_atoms": [
        {
          "id": "F01.G.first_moment",
          "canonical_id": "F01.ATOM.first_moment",
          "text": "Adam maintains an exponentially decaying average of past gradients (the first moment).",
          "span": [
            0,
            86
          ],
          "factual": true,
          "material": true
        },
        {
          "id": "F01.G.second_moment",
          "canonical_id": "F01.ATOM.second_moment",
          "text": "Adam maintains an exponentially decaying average of past squared gradients (the second moment).",
          "span": [
            87,
            182
          ],
          "factual": true,
          "material": true
        }
      ],
      "exclusions": [],
      "candidate_sets": [
        {
          "id": "perfect",
          "candidates": [
            {
              "id": "F01.perfect.C1",
              "canonical_id": "F01.C.first_moment",
              "text": "Adam maintains an exponentially decaying average of past gradients (the first moment).",
              "span": [
                0,
                86
              ],
              "roles": []
            },
            {
              "id": "F01.perfect.C2",
              "canonical_id": "F01.C.second_moment",
              "text": "Adam maintains an exponentially decaying average of past squared gradients (the second moment).",
              "span": [
                87,
                182
              ],
              "roles": []
            }
          ],
          "allowed_matches": [
            {
              "candidate_id": "F01.perfect.C1",
              "gold_id": "F01.G.first_moment"
            },
            {
              "candidate_id": "F01.perfect.C2",
              "gold_id": "F01.G.second_moment"
            }
          ]
        },
        {
          "id": "omission",
          "candidates": [
            {
              "id": "F01.omission.C1",
              "canonical_id": "F01.C.first_moment",
              "text": "Adam maintains an exponentially decaying average of past gradients (the first moment).",
              "span": [
                0,
                86
              ],
              "roles": []
            }
          ],
          "allowed_matches": [
            {
              "candidate_id": "F01.omission.C1",
              "gold_id": "F01.G.first_moment"
            }
          ]
        },
        {
          "id": "reordered",
          "candidates": [
            {
              "id": "F01.perfect.C2",
              "canonical_id": "F01.C.second_moment",
              "text": "Adam maintains an exponentially decaying average of past squared gradients (the second moment).",
              "span": [
                87,
                182
              ],
              "roles": []
            },
            {
              "id": "F01.perfect.C1",
              "canonical_id": "F01.C.first_moment",
              "text": "Adam maintains an exponentially decaying average of past gradients (the first moment).",
              "span": [
                0,
                86
              ],
              "roles": []
            }
          ],
          "allowed_matches": [
            {
              "candidate_id": "F01.perfect.C2",
              "gold_id": "F01.G.second_moment"
            },
            {
              "candidate_id": "F01.perfect.C1",
              "gold_id": "F01.G.first_moment"
            }
          ]
        },
        {
          "id": "empty",
          "candidates": [],
          "allowed_matches": []
        }
      ]
    },
    {
      "id": "F02",
      "title": "L2 repeated paraphrase \u2014 duplicate trap",
      "draft_text": "L2 regularization adds the squared Euclidean norm of the weights to the loss. Equivalently, the L2 penalty adds the squared Euclidean norm of the weights to the loss.",
      "draft_sha256": "197c28002f7b29a9966aa58c8ffcf140088fa5b5c8ca906b0ddf3effaca6c10d",
      "gold_atoms": [
        {
          "id": "F02.G.l2_a",
          "canonical_id": "F02.ATOM.l2_penalty",
          "text": "L2 regularization adds the squared Euclidean norm of the weights to the loss.",
          "span": [
            0,
            77
          ],
          "factual": true,
          "material": true
        },
        {
          "id": "F02.G.l2_b",
          "canonical_id": "F02.ATOM.l2_penalty",
          "text": "the L2 penalty adds the squared Euclidean norm of the weights to the loss.",
          "span": [
            92,
            166
          ],
          "factual": true,
          "material": true
        }
      ],
      "exclusions": [],
      "candidate_sets": [
        {
          "id": "perfect",
          "candidates": [
            {
              "id": "F02.perfect.C1",
              "canonical_id": "F02.C.l2_penalty",
              "text": "L2 regularization adds the squared Euclidean norm of the weights to the loss.",
              "span": [
                0,
                77
              ],
              "roles": []
            }
          ],
          "allowed_matches": [
            {
              "candidate_id": "F02.perfect.C1",
              "gold_id": "F02.G.l2_a"
            }
          ]
        },
        {
          "id": "duplicate",
          "candidates": [
            {
              "id": "F02.duplicate.C1",
              "canonical_id": "F02.C.l2_penalty",
              "text": "L2 regularization adds the squared Euclidean norm of the weights to the loss.",
              "span": [
                0,
                77
              ],
              "roles": [
                "duplicate"
              ]
            },
            {
              "id": "F02.duplicate.C2",
              "canonical_id": "F02.C.l2_penalty",
              "text": "the L2 penalty adds the squared Euclidean norm of the weights to the loss.",
              "span": [
                92,
                166
              ],
              "roles": [
                "duplicate"
              ]
            }
          ],
          "allowed_matches": [
            {
              "candidate_id": "F02.duplicate.C1",
              "gold_id": "F02.G.l2_a"
            },
            {
              "candidate_id": "F02.duplicate.C2",
              "gold_id": "F02.G.l2_b"
            }
          ]
        }
      ]
    },
    {
      "id": "F03",
      "title": "Dropout masks activations + guarantees calibration \u2014 compound trap",
      "draft_text": "Dropout randomly masks activations during training. Dropout guarantees that predicted probabilities are calibrated.",
      "draft_sha256": "ed9fd3972feb059ada2fcc978a417635dd241426cbd4acf7d02437d1a552f903",
      "gold_atoms": [
        {
          "id": "F03.G.masks",
          "canonical_id": "F03.ATOM.masks_activations",
          "text": "Dropout randomly masks activations during training.",
          "span": [
            0,
            51
          ],
          "factual": true,
          "material": true
        },
        {
          "id": "F03.G.calibration",
          "canonical_id": "F03.ATOM.guarantees_calibration",
          "text": "Dropout guarantees that predicted probabilities are calibrated.",
          "span": [
            52,
            115
          ],
          "factual": true,
          "material": true
        }
      ],
      "exclusions": [],
      "candidate_sets": [
        {
          "id": "perfect",
          "candidates": [
            {
              "id": "F03.perfect.C1",
              "canonical_id": "F03.C.masks",
              "text": "Dropout randomly masks activations during training.",
              "span": [
                0,
                51
              ],
              "roles": []
            },
            {
              "id": "F03.perfect.C2",
              "canonical_id": "F03.C.calibration",
              "text": "Dropout guarantees that predicted probabilities are calibrated.",
              "span": [
                52,
                115
              ],
              "roles": []
            }
          ],
          "allowed_matches": [
            {
              "candidate_id": "F03.perfect.C1",
              "gold_id": "F03.G.masks"
            },
            {
              "candidate_id": "F03.perfect.C2",
              "gold_id": "F03.G.calibration"
            }
          ]
        },
        {
          "id": "compound",
          "candidates": [
            {
              "id": "F03.compound.C1",
              "canonical_id": "F03.C.compound_dropout",
              "text": "Dropout randomly masks activations during training and guarantees that predicted probabilities are calibrated.",
              "span": null,
              "roles": [
                "compound"
              ]
            }
          ],
          "allowed_matches": []
        }
      ]
    },
    {
      "id": "F04",
      "title": "BatchNorm training vs inference statistics",
      "draft_text": "During training, BatchNorm uses the current mini-batch mean and variance. During inference, BatchNorm uses the running population mean and variance.",
      "draft_sha256": "fef76e748e7f477a2f560f1d105469100a9aaff076d3dc8814f90fe679b8f47d",
      "gold_atoms": [
        {
          "id": "F04.G.train",
          "canonical_id": "F04.ATOM.train_stats",